2006-12-13T13:47:00Z,Embassy Madrid,"ECON, ETRD, AORC, ASEC, KIPR OECD, SP"
2006-12-12T15:50:00Z,Consulate Montreal,"ECON, ETRD, KIPR, CA"
2006-12-12T12:32:00Z,Consulate Montreal,"ECON, ETRD, KIPR, CA"
2006-12-11T13:17:00Z,Embassy New Delhi,"PREL, PGOV, PTER, ETRD, EFIN, ECON, EINV, KIPR, MARR,"
2006-12-11T03:25:00Z,Embassy Manila,"KIPR, ETRD, ECON, RP"
2006-12-10T10:15:00Z,Embassy Muscat,"ETRD, EIND, PREL, KIPR, KMPI, MU"
2006-12-10T05:28:00Z,Embassy Bangkok,"ECON, ETRD, KIPR, TH"
2006-12-08T10:41:00Z,Embassy Jakarta,"ETRD, EINV, ECON, KIPR, ID"
2006-12-07T14:57:00Z,Embassy Ankara,"ETRD, KIPR, USTR, EUN, TU"
2006-12-07T09:33:00Z,Embassy Rome,"ETRD, EINV, KIPR, PGOV, IT"
2006-12-01T19:09:00Z,Embassy San Salvador,"KIPR, ETRD, ES"
2006-12-01T16:11:00Z,Embassy Dublin,"ECON, ETRD, KIPR, WTRO, EI"
2006-12-01T14:03:00Z,Embassy Paris,"ETRD, ECON, EFIN, KIPR, FR"
2006-12-01T09:32:00Z,Embassy Rome,"ETRD, EINV, KIPR, PGOV, IT"
2006-11-30T15:27:00Z,Embassy Sofia,"ECON, ETRD, KIPR, AORC, BU"
2006-11-30T14:55:00Z,Embassy Madrid,"ECON, ETRD, KIPR, EAGR, EAID, TBIO, SP, EAIR, EINV"
2006-11-30T14:47:00Z,Embassy Vilnius,"ECON, ETRD, KIPR, PGOV, LH, HT50, HT24"
2006-11-30T11:05:00Z,Embassy Sofia,"ECON, KIPR, ETRD, BU"
2006-11-28T23:48:00Z,Embassy Bangkok,"ECON, ETRD, KIPR, TH"
2006-11-24T07:41:00Z,Embassy Vienna,"ECON, ETRD, KIPR, WTRO, AU"
2006-11-21T21:40:00Z,Embassy Ottawa,"CA, ECON, ETRD, KIPR, WTRO"
2006-11-21T17:22:00Z,Consulate Sao Paulo,"KIPR, ETRD, ECON, KJUS, BR"
2006-11-21T17:16:00Z,Embassy Rabat,"ECON, ETRD, KIPR, PGOV, MO"
2006-11-21T16:41:00Z,Embassy Santiago,"ECON, EFIN, PGOV, KIPR, EIND, ETRD, CI"
2006-11-21T01:01:00Z,"American Institute Taiwan, Taipei","ECON, EINV, KIPR, PREL, CH, TW"
2006-11-17T20:50:00Z,Embassy San Jose,"ETRD, ECON, PGOV, KIPR, CS"
2006-11-17T10:10:00Z,Embassy Tunis,"KIPR, ECON, ETRD, TS"
2006-11-17T09:56:00Z,Embassy Tunis,"KIPR, ECON, ETRD, TS"
2006-11-16T17:52:00Z,Consulate Sao Paulo,"KIPR, ETRD, ECON, EINV, KJUS, BR"
2006-11-16T15:29:00Z,Embassy Sofia,"ECON, ETRD, KIPR, AORC, BU"
2006-11-16T12:15:00Z,Embassy Caracas,"KIPR, ECON, ETRD, WIPO, VE"
2006-11-14T06:20:00Z,Embassy Muscat,"BEXP, ECON, KIPR, MU"
2006-11-13T18:34:00Z,Embassy Managua,"TBIO, EAID, ECON, ETRD, EAGR, KIPR, NU"
2006-11-09T14:24:00Z,Embassy Moscow,"KIPR, ETRD, WTO, RS"
2006-11-09T12:30:00Z,Embassy Athens,"ECON, GR, KIPR"
2006-11-09T06:11:00Z,Embassy Colombo,"ECON, ETRD, KIPR, AORC, CE"
2006-11-08T20:55:00Z,Embassy Quito,"ECON, PGOV, KIPR, CVIS, PINR, ETRD, EINV, EC"
2006-11-08T13:57:00Z,Embassy Kuwait,"ETRD, EINV, PGOV, PREL, KIPR, KU"
2006-11-07T06:44:00Z,Embassy Hanoi,"ENRG, TRGY, KIPR, KNNP, KGIT, VM"
2006-11-05T12:29:00Z,Embassy Brasilia,"ETRD, KIPR, EINV, ENRG, WTRO, BEXP, BR"
2006-11-03T16:36:00Z,Embassy Paris,"ETRD, ECON, EFIN, KIPR, FR"
2006-11-03T14:30:00Z,Embassy Belgrade,"BEXP, ECON, ETRD, KIPR, SR, WTO"
2006-11-03T12:14:00Z,Embassy Santiago,"ETRD, KIPR, PREL, CI"
2006-11-03T08:35:00Z,Consulate Guangzhou,"PGOV, ETRD, KIPR, ECON, CH"
2006-11-02T09:26:00Z,Consulate Guangzhou,"KIPR, ECON, ETRD, CH"
2006-11-01T10:52:00Z,Embassy Moscow,"KIPR, ETRD, WTO, RS"
2006-10-30T10:49:00Z,Embassy Hanoi,"PREL, ECON, ETRD, EINV, ENRG, KIPR, JA, VM"
2006-10-30T10:00:00Z,Embassy Hanoi,"PREL, ECON, ETRD, EINV, ENRG, KIPR, JA, VM"
2006-10-27T14:54:00Z,Embassy Tel Aviv,"ECON, ETRD, KIPR, IS"
2006-10-27T10:12:00Z,Embassy Singapore,"ECON, ETRD, EINV, EFIN, KIPR, ECPS, SN"
2006-10-26T09:18:00Z,Embassy Hanoi,"KNNP, ENRG, TRGY, KIPR, VM"
2006-10-23T14:13:00Z,Embassy Madrid,"EAID, EINV, EFIN, PREL, PARM, ETTC, KIPR, SP"
2006-10-23T02:08:00Z,Embassy Hanoi,"KNNP, ENRG, TRGY, KIPR, VM"
2006-10-20T19:26:00Z,Embassy Ottawa,"CA, ECON, ETRD, KIPR"
2006-10-20T04:28:00Z,Embassy Moscow,"ECON, ETRD, KIPR, RS"
2006-10-19T13:25:00Z,Embassy Riga,"ETRD, KIPR, ECON, LG"
2006-10-19T12:00:00Z,Embassy Moscow,"ECON, ENRG, ETRD, KIPR"
2006-10-17T14:52:00Z,Embassy Tel Aviv,"ECON, ETRD, PGOV, KIPR, IS"
2006-10-16T12:30:00Z,Embassy Paris,"ECON, ETRD, KIPR, PGOV, PREL, WTO, FR"
2006-10-16T06:10:00Z,Embassy Riyadh,"ETRD, ECON, KIPR, SA"
2006-10-11T12:52:00Z,Embassy Tunis,"ECON, ETRD, KIPR, AG, FR, MO, TC, UK, TS"
2006-10-05T07:01:00Z,Embassy Hanoi,"CON, ETRD, KIPR, VM"
2006-10-05T04:28:00Z,Embassy Tokyo,"KIPR, ETRD, WTRO, CH, JP"
2006-10-03T13:12:00Z,Embassy Kuwait,"PGOV, KIPR, KTFN, EFIN, PTER, KU"
2006-10-03T09:34:00Z,Embassy Hanoi,"KNNP, ENRG, TRGY, KIPR, VM"
2006-10-02T12:28:00Z,Embassy Rabat,"ECON, ETRD, KIPR"
2006-09-29T17:48:00Z,Embassy Brasilia,"KIPR, ECON, EIND, EINV, ETRD, PGOV, BR"
2006-09-29T08:05:00Z,Consulate Chennai,"ECON, ETRD, PGOV, KIPR, IN"
2006-09-28T11:15:00Z,Embassy Oslo,"ECON, ETRD, EIND, EINV, NO, KIPR"
2006-09-27T05:01:00Z,Consulate Guangzhou,"ECON, EINV, KIPR, CH"
2006-09-25T12:00:00Z,Embassy Muscat,"ECON, ETRD, KIPR, MU"
2006-09-25T07:24:00Z,Consulate Guangzhou,"KIPR, ECON, ETRD, WTRO, CH"
2006-09-22T14:38:00Z,Embassy Warsaw,"ETRD, KIPR, ECON, PL"
2006-09-22T09:44:00Z,Embassy Tunis,"ECON, TINT, KIPR, ECPS, TS"
2006-09-19T10:03:00Z,Embassy Jakarta,"ECON, ETRD, KIPR, ID"
2006-09-15T03:53:00Z,Embassy Ankara,"ETRD, KIPR, USTR, EUN, TU"
2006-09-13T13:28:00Z,Embassy Rome,"ECON, ETRD, AORC, KIPR, EURM, WTRO, USTR, CH, IT"
2006-09-12T06:32:00Z,Consulate Guangzhou,"KIPR, ECON, ETRD, WTRO, CH"
2006-09-11T08:26:00Z,Embassy Tunis,"ECON, ETRD, KIPR, LY, TS"
2006-09-11T03:19:00Z,Embassy Manila,"ECON, ETRD, EINV, KIPR, RP"
2006-09-07T14:27:00Z,Embassy Paris,"KIPR, ETRD, FR"
2006-09-06T10:48:00Z,Embassy Niamey,"ECON, ETRD, AORC, ASEC, KIPR, OTRA, NG"
2006-09-05T15:57:00Z,Consulate Sao Paulo,"ECON, EINV, ETRD, BEXP, KIPR, BR"
2006-09-05T06:21:00Z,Embassy Manila,"ECON, ETRD, EINV, KIPR, RP"
2006-09-01T19:03:00Z,Embassy Kingston,"PGOV, PREL, EFIN, ECON, EINV, PHUM, ELAB, IDB, KIPR, JM"
2006-08-30T04:31:00Z,Embassy Muscat,"BEXP, ECON, KIPR, TSPL, ETRD, MU"
2006-08-29T22:40:00Z,Embassy Beijing,"ECON, EINV, EFIN, KIPR, CH"
2006-08-29T22:39:00Z,Embassy Beijing,"ECON, EINV, EFIN, KIPR, CH"
2006-08-29T11:55:00Z,Embassy The Hague,"ECON, ETRD, AORC, KIPR, EURM, WTRO, USTR, CH, NL"
2006-08-29T07:20:00Z,Embassy Manila,"ECON, ETRD, EINV, KIPR, RP"
2006-08-28T17:18:00Z,Embassy Ottawa,"CA, CH, KIPR, ECON, ETRD, AORC, WTRO, USTR"
2006-08-27T04:09:00Z,Embassy Abu Dhabi,"KIPR, ECON, PREL, AE"
2006-08-25T05:16:00Z,Embassy Riga,"ECON, ETRD, AORC, KIPR, EURM, WTRO, USTR, CH, LG"
2006-08-25T01:22:00Z,Embassy Hanoi,"KNNP, ENRG, TRGY, KIPR, VM"
2006-08-24T12:06:00Z,Consulate Sao Paulo,"ETRD, ECON, KIPR, EINV, BR"
2006-08-24T08:59:00Z,Embassy Brasilia,"KIPR, KCRM, ETRD, BR"
2006-08-24T05:43:00Z,Embassy Paris,"ECON, ETRD, AORC, KIPR, EURM, WTRO, CH, FR"
2006-08-24T05:36:00Z,Embassy Lisbon,"ECON, ETRD, AORC, KIPR, EURM, WTRO, USTR, CH, PO"
2006-08-23T14:27:00Z,Embassy Dublin,"ECON, ETRD, AORC, KIPR, EURM, WTRO, USTR, EI"
2006-08-22T08:47:00Z,Embassy Jakarta,"KIPR, ETRD, WTO, ECON, ID"
2006-08-18T14:04:00Z,Consulate Sao Paulo,"KIPR, ETRD, ECON, KJUS, BR"
2006-08-18T13:02:00Z,Embassy Berlin,"KIPR, ECON, ETRD, AORC, WTRO, GM"
2006-08-18T10:50:00Z,Embassy Tunis,"ECON, ETRD, KIPR, TS"
2006-08-18T09:26:00Z,Embassy Bangkok,"ECON, KIPR, TH"
2006-08-18T08:20:00Z,Embassy Prague,"ECON, ETRD, AORC, KIPR, EURM, WTRO, USTR, CH, EZ"
2006-08-17T19:36:00Z,Embassy Santiago,"KIPR, ECON, ETRD, PREL, CI"
2006-08-17T12:53:00Z,Embassy Vienna,"ECON, ETRD, AORC, KIPR, EURM, WTRO, USTR, CH, AU"
2006-08-17T12:23:00Z,Embassy Athens,"ECON, GR, KIPR"
2006-08-17T06:00:00Z,Consulate Guangzhou,"KIPR, ECON, CH"
2006-08-17T05:58:00Z,Consulate Guangzhou,"KIPR, ECON, PGOV, CH"
2006-08-17T05:21:00Z,Embassy Tokyo,"KIPR, ECON, ETRD, AORC, WTRO, CH, JA"
2006-08-16T17:52:00Z,Embassy Brasilia,"ETRD, KIPR, ECON, BR"
2006-08-16T15:13:00Z,Embassy Brasilia,"ETRD, BEXP, KIPR, EFIN, SENV, BR"
2006-08-16T12:16:00Z,Consulate Istanbul,"ETRD, KIPR, USTR, TU"
2006-08-16T05:24:00Z,Embassy Bangkok,"KIPR, TH"
2006-08-16T04:41:00Z,Embassy Nicosia,"KIPR, ECON, ETRD, CY"
2006-08-16T01:57:00Z,Embassy Bangkok,"KIPR, TH"
2006-08-15T14:46:00Z,Consulate Istanbul,"ETRD, KIPR, USTR, TU"
2006-08-14T12:31:00Z,Embassy Muscat,"ETRD, ECON, BEXP, KIPR, PREL, MU"
2006-08-14T07:30:00Z,Embassy Jakarta,"KIPR, ETRD, WTO, ECON, ID"
2006-08-14T06:52:00Z,Embassy Beijing,"PREL, ENRG, SENV, KIPR, OREP, CH, TW"
2006-08-11T09:40:00Z,Embassy Nicosia,"ECON, ETRD, AORC, KIPR, EURM, WTRO, USTR, CH, CY, EUN"
2006-08-10T21:29:00Z,Embassy Ottawa,"CA, CH, KIPR, ECON, ETRD, AORC, WTRO, USTR"
2006-08-09T20:55:00Z,Embassy Ottawa,"CA, KIPR, ECON"
2006-08-09T17:45:00Z,Embassy Brasilia,"ETRD, BEXP, KIPR, EIND, BR"
2006-08-08T05:45:00Z,Embassy Jakarta,"ETRD, EINV, ECON, KIPR, ID"
2006-08-07T15:28:00Z,Embassy Caracas,"KIPR, ETRD, VE"
2006-08-07T12:33:00Z,Embassy Warsaw,"ETRD, KIPR, TBIO, EINV, PL"
2006-08-02T15:18:00Z,Embassy Paris,"KIPR, ETRD, PGOV, FR"
2006-08-02T08:23:00Z,Embassy Manila,"ETRD, EAGR, PREL, ETTC, EINV, KIPR, RP"
2006-08-02T03:17:00Z,Embassy Manila,"ETRD, EAGR, ETTC, EINV, KIPR, RP"
2006-08-01T07:52:00Z,Embassy Beijing,"ETRD, EAGR, ECON, WTRO, KIPR, CH, TW"
2006-07-31T20:08:00Z,Embassy Mexico,"ECON, ETRD, KIPR, KPAO, WTRO, MX"
2006-07-23T13:08:00Z,Embassy Kuwait,"BEXP, EINV, KIPR, OVIP, PREL, KU"
2006-07-20T00:53:00Z,Embassy Tokyo,"KIPR, ECON, JP"
2006-07-19T12:44:00Z,Embassy Athens,"KIPR, ECON, ETRD,GR"
2006-07-19T04:28:00Z,Embassy Tunis,"KIPR, ETRD, ECON, TS"
2006-07-19T02:13:00Z,Embassy Jakarta,"KIPR, ETRD, ECON, ID"
2006-07-17T11:32:00Z,Embassy Athens,"KIPR, ECON, ETRD, GR"
2006-07-14T07:25:00Z,Embassy Tel Aviv,"PGOV, PREL, PHUM, KIPR, KOMC, IS, GTIP, GOI INTERNAL"
2006-07-14T03:48:00Z,Embassy Sofia,"ECON, ETRD, KIPR, BU"
2006-07-12T08:13:00Z,Consulate Guangzhou,"KIPR, ETRD, ECON, WTRO, CH"
2006-07-12T07:08:00Z,Embassy Tunis,"ECON, EINV, ENRG, ETRD, ELAB, KIPR, TS"
2006-07-11T23:47:00Z,Embassy Tokyo,"KIPR, ETRD, WTRO, CH, JP"
2006-07-10T10:48:00Z,Embassy Santo Domingo,"DR, ETRD, KIPR"
2006-07-10T07:28:00Z,Embassy Jakarta,"ETRD, EINV, ECON, KIPR, ID"
2006-07-08T10:25:00Z,Embassy Kuwait,"BEXP, EINV, KIPR, OVIP, PREL, KU"
2006-07-07T09:39:00Z,Embassy Rome,"ETRD, EINV, KIPR, IT"
2006-07-06T15:07:00Z,Embassy Baghdad,"EAGR, EAID, ECON, ELAB, ETRD, IZ, KIPR"
2006-07-06T09:35:00Z,Embassy Hanoi,"ETRD, ECON, KIPR, WTRO, VM"
2006-07-05T18:06:00Z,Embassy Brasilia,"KIPR, ECPS, BR"
2006-07-03T07:42:00Z,Consulate Guangzhou,"KIPR, ECON, ETRD, WTRO, CH"
2006-06-30T13:57:00Z,Embassy Rome,"ETRD, EINV, KIPR, CH, IT"
2006-06-29T18:57:00Z,Embassy Ottawa,"KIPR, ECON, TBIO, CA"
2006-06-29T10:54:00Z,Embassy Phnom Penh,"ELAB, ECON, PGOV, KTEX, KIPR, CB"
2006-06-28T10:00:00Z,Embassy Paris,"KIPR, ETRD, PGOV, FR"
2006-06-28T07:36:00Z,Embassy Jakarta,"KIPR, ETRD, WTO, ECON, ID"
2006-06-28T07:04:00Z,Embassy Jakarta,"KIPR, ETRD, WTO, ECON, ID"
2006-06-28T05:23:00Z,Embassy Tokyo,"KIPR, ETRD, ECON, JP"
2006-06-26T12:10:00Z,Embassy Lima,"ECON, ETRD, KIPR, PE"
2006-06-23T13:49:00Z,Embassy Athens,"KIPR, ECON, ETRD, GR"
2006-06-23T11:16:00Z,Embassy Beirut,"ECON, EINV, ETRD, KIPR, LE"
2006-06-23T08:47:00Z,Embassy Rome,"ETRD, EINV, KIPR, CH, IT"
2006-06-23T06:31:00Z,"American Institute Taiwan, Taipei","ECON, KIPR, ETRD, TW"
2006-06-22T14:15:00Z,Consulate Sao Paulo,"ECON, EINV, KIPR, PGOV, ETRD, BR"
2006-06-22T12:36:00Z,Embassy San Salvador,"APER, SNAR, KCRM, KIPR, KJUS, ES"
2006-06-22T08:48:00Z,Embassy Vientiane,"ETRD, KIPR, EFIN, LA"
2006-06-21T18:00:00Z,Embassy Brasilia,"ETRD, ECON, KIPR, EINV, ENRG, BEXP, BR"
2006-06-21T12:22:00Z,Embassy Brasilia,"ETRD, ECON, KIPR, EINV, ENRG, BEXP, BR"
2006-06-21T10:59:00Z,Embassy Oslo,"ETRD, ECON, EINV, KIPR, NO"
2006-06-20T17:50:00Z,Embassy Brasilia,"ETRD, ECON, KIPR, EINV, ENRG, BEXP, BR"
2006-06-20T15:20:00Z,Embassy Tel Aviv,"ECON, ETRD, PREL, PGOV, KIPR, IS, KINR, GTIP, ECONOMY AND FINANCE, U.S.-ISRAEL RELATIONS"
2006-06-16T15:30:00Z,Consulate Sao Paulo,"OVIP, ETRD, BEXP, KIPR, EINV, PGOV, EAGR, ENRG, BR"
2006-06-16T15:18:00Z,Embassy Caracas,"ECON, KIPR, VE"
2006-06-15T14:02:00Z,Embassy Cairo,"ETRD, KIPR, EG, USTR"
2006-06-14T17:40:00Z,Embassy Brasilia,"ETRD, ECON, KIPR, EINV, EPET, KTFN, BEXP, BR"
2006-06-14T14:04:00Z,Embassy Lima,"ETRD, ECON, EINV, PGOV, KIPR, PREL, PE"
2006-06-14T12:47:00Z,Embassy Brasilia,"KIPR, ETRD, BR"
2006-06-14T07:05:00Z,Embassy Hanoi,"ETRD, EINV, EAID, ECON, KIPR, PREL, VM"
2006-06-13T20:23:00Z,Embassy Lima,"ETRD, ECON, EINV, PGOV, KIPR, PREL, PE"
2006-06-13T20:22:00Z,Embassy Lima,"ETRD, ECON, EINV, PGOV, KIPR, PREL, PE"
2006-06-13T11:15:00Z,Embassy Brasilia,"ETRD, ECON, KIPR, EPET, KTFN, BEXP, BR"
2006-06-13T10:26:00Z,Embassy Zagreb,"ECON, ETRD, KIPR, HR"
2006-06-13T07:20:00Z,Consulate Lagos,"ECON, EFIN, EINV, ETRD, KIPR, PGOV, NI"
2006-06-12T04:24:00Z,Embassy Muscat,"ECON, KIPR, ECPS, MU, Economic Affairs"
2006-06-09T07:26:00Z,Embassy Beijing,"ECON, ETRD, EINV, KIPR, PGOV, CH"
2006-06-08T09:23:00Z,Embassy Bangkok,"ECON, KIPR, TH"
2006-06-07T21:53:00Z,Embassy Beijing,"ETRD, ECON, KIPR, WTRO, PREL, OREP, CH"
2006-06-07T18:57:00Z,Embassy Port Of Spain,"EINV, ECPS, EFIN, KIPR, KFLU, SENV, TD"
2006-06-07T14:18:00Z,Embassy Santo Domingo,"ENRG, PREL, PGOV, KCRM, KIPR, KUNP, HA, DR"
2006-06-07T02:01:00Z,Consulate Guangzhou,"KIPR, ECON, ETRD, WTRO, CH"
2006-06-06T20:29:00Z,Embassy Lima,"ECON, ETRD, KIPR, PE"
2006-06-06T18:46:00Z,Embassy Santo Domingo,"PREL, EAID, ETRD, KDEM, KIPR, DR"
2006-06-06T07:27:00Z,Embassy Jakarta,"ECON, ETRD, KIPR, WTRO, ID"
2006-06-05T13:22:00Z,Embassy Amman,"ECON, ETRD, KIPR, WTRO, JO"
2006-06-02T19:27:00Z,Embassy Georgetown,"ECON, ETRD, KIPR, WTRO, GY"
2006-06-02T18:53:00Z,Embassy Ottawa,"ETRD, KIPR, CA"
2006-06-02T08:26:00Z,Embassy Singapore,"KIPR, ECON, ETRD, EINV, SN"
2006-06-01T15:33:00Z,Embassy Dakar,"ETRD, KIPR, EIND, ECON, SCUL, PGOV, KPAO, SG"
2006-06-01T14:04:00Z,Embassy Port Of Spain,"ETRD, KIPR, WTRO, TD, XL"
2006-06-01T04:41:00Z,Embassy Warsaw,"ETRD, EINV, ETRD, KIPR, PL"
2006-05-30T14:57:00Z,Embassy Paris,"EFIN, KIPR, ETRD, ECPS, PGOV, FR"
2006-05-30T07:17:00Z,Consulate Guangzhou,"KIPR, ECON, PGOV, CH"
2006-05-30T07:16:00Z,Consulate Guangzhou,"KIPR, PGOV, ECON, ETRD, CH"
2006-05-30T06:27:00Z,Embassy Bangkok,"KIPR, EAGR, TH"
2006-05-25T07:04:00Z,"American Institute Taiwan, Taipei","ECON, PINR, KIPRTRD, PREL, CM, TW"
2006-05-25T06:10:00Z,Embassy Manila,"ECON, ETRD, EINV, KIPR, WTRO, RP"
2006-05-25T05:34:00Z,Consulate Hong Kong,"KIPR, ECON, CH, HK"
2006-05-24T23:28:00Z,Consulate Hong Kong,"KIPR, ECON, CH, HK"
2006-05-24T08:42:00Z,Consulate Sao Paulo,"KIPR, ETRD, KJUS, EIND, EAGR, BR"
2006-05-24T02:03:00Z,Embassy Manila,"ECON, ETRD, KIPR, BEXP, RP"
2006-05-23T07:36:00Z,Consulate Guangzhou,"KIPR, KJUS, KCRM, ECON, ETRD, CH"
2006-05-23T07:19:00Z,Embassy Manila,"ECON, ETRD, KIPR, BEXP, RP"
2006-05-22T16:22:00Z,Embassy Brasilia,"KIPR, ETRD, ECON, BR"
2006-05-19T16:41:00Z,Embassy Tel Aviv,"ECON, ETRD, KIPR, IS, GOI INTERNAL, ECONOMY AND FINANCE"
2006-05-19T12:36:00Z,Embassy Nicosia,"ECON, ETRD, KIPR, CY"
2006-05-19T08:27:00Z,Consulate Hong Kong,"KIPR, ECON, CH, HK"
2006-05-18T19:25:00Z,Embassy Ottawa,"KIPR, ECON, CA"
2006-05-17T06:51:00Z,Embassy Tokyo,"ECON, ETRD, KIPR, WTRO, JP"
2006-05-17T00:06:00Z,Embassy Singapore,"KCRM, KTFN, ETTC, KTFN, EFIN, SNAR, SENV, PHUM, KIPR,"
2006-05-16T23:10:00Z,Consulate Guangzhou,"KIPR, KJUS, KCRM, ECON, ETRD, WTRO, CH"
2006-05-12T14:03:00Z,Embassy San Salvador,"EFIN, PINR, PINS, PREL, SNAR, KCRM, KIPR, KJUS, ES"
2006-05-12T12:15:00Z,Embassy Paris,"KIPR, ETRD, PGOV, FR"
2006-05-12T10:51:00Z,Consulate Hong Kong,"PREL, PGOV, KIPR, KJUS, ECON, PINR, HK, CH, EINT"
2006-05-11T17:40:00Z,Embassy Brasilia,"KHIV, KIPR, TBIO, KSCA, EAID, BR"
2006-05-11T17:37:00Z,Embassy Managua,"KIPR, KCRM, ABUD, AFIN, SNAR, ECON, ETRD"
2006-05-11T08:37:00Z,Embassy Singapore,"KIPR, ECON, ETRD, EINV, SN"
2006-05-11T04:48:00Z,Embassy Amman,"ETRD, KIPR, ELAB, JO, IZ"
2006-05-10T13:20:00Z,Embassy Moscow,"ECON, PREL, PGOV, KIPR, KCRM, RS"
2006-05-10T12:13:00Z,Embassy Dushanbe,"ECON, ETRD, KIPR, TI"
2006-05-10T09:04:00Z,Embassy Beirut,"EFIN, ECON, ETRD, EINV, KIPR, LE"
2006-05-09T09:40:00Z,Embassy Vilnius,"ECON, ETRD, KIPR, LH, HT50, HT24"
2006-05-08T18:22:00Z,Embassy Port Of Spain,"ETRD, KIPR, TD, XL"
2006-05-08T18:22:00Z,Embassy Port Of Spain,"ETRD, KIPR, TD, XL"
2006-05-07T11:36:00Z,Embassy Kuwait,"ETRD, ECON, KIPR, KU"
2006-05-05T19:04:00Z,Embassy La Paz,"KIPR, ECON, ETRD, EINV, BL"
2006-05-05T18:52:00Z,Embassy Ottawa,"OREP, ASEC, PREL, KIPR, CA"
2006-05-05T09:18:00Z,Embassy Jakarta,"ETRD, EINV, ECON, KIPR, ID"
2006-05-05T05:11:00Z,Embassy Nairobi,"ECON, ETRD, KIPR, KE"
2006-05-04T17:10:00Z,Embassy Lima,"KIPR, ECON, ETRD, PE"
2006-05-04T11:14:00Z,Embassy Beirut,"ECON, EINV, EFIN, KIPR, LE"
2006-05-04T10:43:00Z,Embassy Minsk,"ECON, ETRD, KIPR, USTR, BO"
2006-05-04T10:04:00Z,Embassy Rabat,"ECON, ETRD, ENRG, EFIN, EAGR, KIPR, KTEX, MO"
2006-05-03T23:40:00Z,"American Institute Taiwan, Taipei","KIPR, ECON, EINV, KCRM, TW"
2006-05-03T09:52:00Z,"American Institute Taiwan, Taipei","ECON, KIPR, TW"
2006-05-03T03:31:00Z,Embassy Singapore,"ETRD, ECON, EINV, ETTC, ECPS, EPET, EAGR, KIPR, SN"
2006-05-02T19:30:00Z,Embassy Ottawa,"CA, KIPR, ECON, ETRD"
2006-05-02T12:51:00Z,Embassy Brasilia,"ETRD, KIPR, BR"
2006-05-02T12:35:00Z,Embassy Kuwait,"ETRD, EINV, PGOV, PREL, KIPR, KMPI, KU"
2006-05-02T11:20:00Z,Embassy Manama,"PGOV, PREL, PTER, ETRD, KIPR, ETTC, BA, BILAT, ECTRD,"
2006-05-02T03:15:00Z,Embassy Kuala Lumpur,"ETRD, KIPR, MY"
2006-05-01T20:18:00Z,Embassy Nassau,"ECON, ETRD, KIPR, BF"
2006-05-01T14:11:00Z,Embassy Managua,"NU, KIPR, ECON, ETRD"
2006-05-01T14:09:00Z,Embassy Kingston,"ECON, ETRD, KIPR, JM"
2006-04-28T18:05:00Z,Embassy Lima,"ECON, ETRD, KIPR, PE"
2006-04-28T14:20:00Z,Embassy Paris,"KIPR, ETRD, PGOV, FR"
2006-04-28T09:12:00Z,Embassy Hanoi,"ECON, ETRD, KIPR, VM"
2006-04-28T08:05:00Z,Consulate Guangzhou,"KIPR, KJUS, KCRM, ETRD, CH"
2006-04-28T03:44:00Z,Embassy Tokyo,"KIPR, ECON, JP"
2006-04-28T03:43:00Z,Embassy Tokyo,"KIPR, ECON, JP"
2006-04-27T08:43:00Z,Consulate Guangzhou,"ECON, KIPR, EINV, PHUM, KPAO, PINR, AMGT, CMGT, CH"
2006-04-27T06:22:00Z,Embassy Manila,"ETRD, EAGR, ETTC, EINV, KIPR, RP"
2006-04-26T11:30:00Z,Embassy Lima,"ECON, ETRD, KIPR, EINV, PGOV, PE"
2006-04-25T08:45:00Z,Embassy Kuala Lumpur,"KIPR, ETRD, MY"
2006-04-24T15:40:00Z,Embassy Brasilia,"ETRD, KIPR, ECON, BR"
2006-04-24T09:16:00Z,Embassy Jakarta,"KIPR, ETRD, WTO, ID"
2006-04-21T10:41:00Z,Embassy Bratislava,"KIPR, ETRD, ECON, LO"
2006-04-19T12:21:00Z,Embassy Paris,"KIPR, SCUL, FR"
2006-04-14T05:59:00Z,Embassy Tokyo,"KIPR, ECON, JP"
2006-04-13T12:05:00Z,Embassy Amman,"ECON, ETRD, TSPL, KIPR, TBIO, JO"
2006-04-13T06:33:00Z,Consulate Guangzhou,"KIPR, ECON, ETRD, EINV, KPAO, ELAB, CH"
2006-04-12T07:38:00Z,Embassy Manila,"ETRD, ECON, KIPR, EINV, RP"
2006-04-12T06:17:00Z,Consulate Guangzhou,"ECON, KIPR, SCUL, ELAB, PINR, CH"
2006-04-12T03:10:00Z,Consulate Guangzhou,"ECON, KIPR, SCUL, ETRD, EINV, CH"
2006-04-11T17:07:00Z,Consulate Montreal,"ECON, ETRD, KIPR, CA"
2006-04-10T19:40:00Z,Embassy San Salvador,"KIPR, ECON, ES, CAFTA"
2006-04-10T04:21:00Z,Consulate Guangzhou,"KIPR, ECON, SCUL, EINV, PHUM, KPAO, PINR, CH"
2006-04-10T02:37:00Z,Consulate Guangzhou,"KIPR, ECON, EINV, KPAO, PINR, CH"
2006-04-07T13:00:00Z,Embassy Ankara,"ETRD, KIPR, USTR, TU"
2006-04-07T09:29:00Z,Embassy Jakarta,"ETRD, EINV, ECON, KIPR, ID"
2006-04-07T02:34:00Z,Consulate Guangzhou,"ECON, KIPR, EINV, PHUM, KPAO, PINR, CH"
2006-04-06T22:42:00Z,Consulate Guangzhou,"ECON, KIPR, EINV, PHUM, KPAO, PINR, AMGT, CMGT, CH"
2006-04-06T07:22:00Z,Embassy Singapore,"ETRD, EFIN, EINV, ECPS, SENV, EAGR, KTEX, KIPR, ETTC, SN"
2006-04-06T06:05:00Z,Consulate Guangzhou,"KIPR, ECON, ETRD, CH"
2006-04-05T22:59:00Z,Embassy Jakarta,"ETRD, KIPR, PGOV, ID"
2006-04-05T16:35:00Z,Embassy Dakar,"ETRD, KIPR, EIND, ECON, SCUL, PGOV, SG"
2006-04-05T10:06:00Z,Embassy Paris,"KIPR, ETRD, ECON, FR"
2006-04-05T08:15:00Z,Consulate Guangzhou,"KIPR, ECON, ETRD, CH"
2006-04-03T18:19:00Z,Consulate Sao Paulo,"ETRD, EAGR, ECIN, KIPR, PGOV, PREL, BR"
2006-03-31T14:14:00Z,Embassy Ankara,"ETRD, KIPR, KCRM, TU"
2006-03-31T14:13:00Z,Embassy Ankara,"ETRD, KIPR, KCRM, TU"
2006-03-31T12:15:00Z,Embassy Asuncion,"PGOV, KCRM, KCMA, KIPR, PA"
2006-03-30T13:57:00Z,Embassy Dublin,"ETRD, KIPR, EUN, EI"
2006-03-30T10:19:00Z,Embassy Vienna,"ETRD, KIPR, EUN, AU"
2006-03-30T09:21:00Z,Embassy Beijing,"ETRD, KIPR, BEXP, EFIN, PREL, CH"
2006-03-29T01:49:00Z,Embassy Kuala Lumpur,"ETRD, KIPR, MY"
2006-03-29T01:39:00Z,Embassy Kuala Lumpur,"ETRD, EAGR, KIPR, EINV, MY, AU"
2006-03-28T20:07:00Z,Consulate Montreal,"ECON, ETRD, KIPR, CA"
2006-03-28T14:03:00Z,Embassy Beijing,"ETRD, KIPR, BEXP, EFIN, PREL, CH"
2006-03-27T15:38:00Z,Embassy Brasilia,"ETRD, ECPS, EAGR, KIPR, PGOV, PREL, BR, CH"
2006-03-27T13:16:00Z,Embassy Rome,"ECON, KIPR, IT, EUN"
2006-03-27T12:07:00Z,Embassy Warsaw,"ETRD, KIPR, PL, Economy"
2006-03-26T08:21:00Z,Embassy Muscat,"ECON, ETRD, AORC, ASEC, KIPR, OTRA, KMPI, MU"
2006-03-24T19:34:00Z,Embassy La Paz,"KIPR, EINV, ECON, BL"
2006-03-24T11:47:00Z,Embassy Jakarta,"KIPR, ETRD, ID"
2006-03-24T08:30:00Z,Embassy Jakarta,"KIPR, EFIN, EINV, ECON, PGOV, ID"
2006-03-24T07:34:00Z,Embassy Manila,"ETRD, ECON, KIPR, EINV, RP"
2006-03-24T04:31:00Z,Embassy Singapore,"ECON, ETRD, EINV, KIPR, PREL, PGOV, EFIN, PTER, EAIR,"
2006-03-23T11:13:00Z,Embassy Jakarta,"KIPR, ETRD, WTO, ID"
2006-03-23T10:59:00Z,Embassy Brasilia,"BEXP, KIPR, KCRM, ASEC, ECPS, EAIR, BR"
2006-03-23T10:00:00Z,Embassy Ashgabat,"KIPR, BTIO, ETRD, ECON, SNAR, TX"
2006-03-23T06:18:00Z,Embassy Singapore,"ECON, ETRD, EINV, EFIN, KIPR, ELAB, SN"
2006-03-22T19:26:00Z,Embassy Brasilia,"BEXP, KIPR, KCRM, ASEC, ECPS, EAIR, BR"
2006-03-22T17:30:00Z,Embassy Mexico,"ECON, PGOV, KIPR, MX"
2006-03-22T15:31:00Z,Embassy Paris,"KIPR, ETRD, FR"
2006-03-22T13:22:00Z,Embassy Kuwait,"PREL, ETRD, KIPR, EFIN, ECON, BEXP, KU"
2006-03-22T09:01:00Z,Embassy Oslo,"ETRD, KIPR, MARR, MASS, EFIS, PREL, NO"
2006-03-21T17:22:00Z,Embassy Rabat,"ETRD, EAGR, BEXP, KIPR, KTIA, MO"
2006-03-21T17:05:00Z,Embassy Rabat,"ETRD, EAGR, BEXP, KIPR, KTIA, MO"
2006-03-20T09:56:00Z,Embassy Singapore,"KIPR, ECON, ETRD, EINV, USTR, WTRO, SN"
2006-03-17T10:30:00Z,Embassy Manila,"ETRD, EAGR, ETT, EINV, KIPR, RP"
2006-03-17T10:30:00Z,Embassy Manila,"ETRD, EAGR, ETTC, EINV, KIPR, RP"
2006-03-17T10:30:00Z,Embassy Manila,"ETRD, EAGR, ETTC, EINV, KIPR, RP"
2006-03-16T14:32:00Z,Embassy San Jose,"ECON, ETRD, KIPR, WTRO"
2006-03-15T16:24:00Z,Embassy Managua,"KIPR, ECON, ETRD, WTRO"
2006-03-15T02:27:00Z,Embassy Singapore,"KIPR, ECON, ETRD, EINV, SN"
2006-03-14T19:25:00Z,Embassy Bridgetown,"KIPR, ECON, ETRD, WTRO, XL"
2006-03-14T14:46:00Z,Embassy Amman,"ECON, ETRD, KIPR, JO, WTRO"
2006-03-14T11:52:00Z,Embassy Jakarta,"KIPR, ETRD, WTO, ID"
2006-03-14T11:22:00Z,Embassy Georgetown,"ECON, ETRD, KIPR, WTRO, GY"
2006-03-14T11:10:00Z,Embassy Belgrade,"EFIN, ECON, ECPS, ENRG, EINV, KIPR, SR, MW, Economic Development"
2006-03-14T09:48:00Z,Embassy Maputo,"ECON, ETRD, KIPR, WTO, MZ"
2006-03-13T10:54:00Z,Embassy Rabat,"ETRD, EAGR, BEXP, KIPR, KTIA, MO"
2006-03-10T15:56:00Z,Embassy Bratislava,"KIPR, ETRD, ECON, LO"
2006-03-10T13:13:00Z,Embassy Beirut,"EFIN, ECON, ETRD, EINV, KIPR, LE, SY"
2006-03-10T09:55:00Z,Embassy Beijing,"ETRD, WTRO, KIPR, PREL, EFIN, CH, JA"
2006-03-10T03:41:00Z,Embassy Wellington,"OTRA, ETRD, ECON, KIPR, NZ"
2006-03-07T08:43:00Z,Embassy Beirut,"EFIN, ECON, ETRD, EINV, KIPR, LE"
2006-03-07T01:50:00Z,Consulate Hong Kong,"PGOV, KIPR, ETRD, ECON, INRB, HK"
2006-03-03T21:02:00Z,Embassy Bogota,"KIPR, ETRD, ECON, CO"
2006-03-03T07:51:00Z,Embassy Manila,"ECON, ETRD, KIPR, KCOR, RP"
2006-03-02T17:18:00Z,Embassy Santo Domingo,"ETRD, DR, KIPR"
2006-03-02T07:46:00Z,Embassy Manila,"ECON, ETRD, KIPR, KCOR, RP"
2006-03-02T04:04:00Z,Embassy Wellington,"OTRA, ECON, ETRD, KIPR, NZ"
2006-02-28T13:41:00Z,Embassy Cairo,"ECON, ETRD, KIPR, EG, USTR"
2006-02-27T23:57:00Z,Embassy Kuala Lumpur,"KIPR, ETRD, MY"
2006-02-27T21:53:00Z,Embassy Managua,"EINV, ETRD, KIDE, KIPR, CVIS, PREL, BEXP, NU"
2006-02-27T12:22:00Z,Embassy Tel Aviv,"ECON, ETRD, KIPR, IS, ECONOMY AND FINANCE"
2006-02-27T06:45:00Z,Consulate Lagos,"ECON, EIND, KIPR, PREL, CH, AE, NI"
2006-02-24T18:12:00Z,Embassy Nassau,"ETRD, BF, KIPR"
2006-02-24T15:47:00Z,Embassy Warsaw,"ETRD, KIPR, PL, Economy"
2006-02-24T15:26:00Z,Embassy Port Of Spain,"ETRD, KIPR, TD"
2006-02-24T12:30:00Z,Embassy Athens,"KIPR, ECON, GR"
2006-02-24T10:57:00Z,Embassy Paris,"KIPR, ETRD, ECON, FR"
2006-02-24T10:44:00Z,Embassy Jakarta,"ETRD, KIPR, PGOV, ID"
2006-02-24T07:32:00Z,Embassy Ulaanbaatar,"KIPR, ETRD, ECON, PGOV, MG"
2006-02-24T05:29:00Z,"American Institute Taiwan, Taipei","KIPR, ECON, ETRD, TW"
2006-02-23T22:46:00Z,Embassy Seoul,"ETRD, KIPR, ECON, PREL, KS"
2006-02-23T21:28:00Z,Embassy San Salvador,"KIPR, ETRD, ECON, ES, CAFTA"
2006-02-23T19:27:00Z,Consulate Sao Paulo,"KIPR, ETRD, KJUS, BR"
2006-02-23T15:43:00Z,Embassy Oslo,"ETRD, KIPR, ECON, NO"
2006-02-23T13:53:00Z,Embassy Santo Domingo,"KIPR, ETRD, DR"
2006-02-23T10:14:00Z,Consulate Sao Paulo,"ECON, EWWT, PGOV, KIPR, ETRD, BEXP, BR"
2006-02-23T05:50:00Z,Embassy Minsk,"KIPR, ETRD, ECON, BO"
2006-02-22T22:40:00Z,Embassy Santiago,"ETRD, KIPR, PREL, CI"
2006-02-22T19:10:00Z,Embassy Caracas,"KIPR, VE"
2006-02-22T18:32:00Z,Embassy Santiago,"KMDR, KPAO, OPRC, CI, KIPR, IPR"
2006-02-22T15:54:00Z,Embassy Lima,"ECON, ETRD, KIPR, PE"
2006-02-22T15:28:00Z,Embassy Kuwait,"PGOV, PREL, PINR, ECON, ETRD, KU, KIPR"
2006-02-22T14:32:00Z,Embassy Managua,"KIPR, ECON, ETRD, NU"
2006-02-22T14:28:00Z,Embassy Rome,"ETRD, EINV, KIPR, IT"
2006-02-22T13:19:00Z,Embassy Ankara,"ETRD, KIPR, TU, USTR"
2006-02-22T12:51:00Z,Embassy Warsaw,"ETRD, KIPR, PL, Economy"
2006-02-22T12:31:00Z,Embassy Belgrade,"ECON, PREL, SR, MW, KIPR, Economic Development"
2006-02-22T09:55:00Z,Embassy Amman,"ETRD, KIPR, ECON, KTIA, PGOV, JO"
2006-02-22T09:54:00Z,Embassy Yerevan,"ETRD, ECON, KIPR, AM"
2006-02-22T06:42:00Z,Embassy Bangkok,"ECON, ETRD, KIPR, TH"
2006-02-22T06:27:00Z,Embassy Wellington,"KIPR, ETRD, ECON, PREL, NZ"
2006-02-22T05:57:00Z,Embassy Rangoon,"ECON, ETRD, KIPR, PGOV, SNAR, BM, Economy"
2006-02-22T04:27:00Z,Consulate Hong Kong,"KIPR, ETRD, EIND, HK"
