2010-02-26T22:17:00Z,Embassy San Salvador,"ECON, ETRD, KIPR, ES"
2010-02-26T13:13:00Z,Embassy La Paz,"ECON, ETRD, KIPR, BL"
2010-02-26T12:07:00Z,Embassy Paris,"ECON, ETRD, EIND, EINV, EUN, KIPR, FR"
2010-02-26T04:59:00Z,Embassy Beijing,"PREL, PGOV, PHUM, MASS, ETRD, KIPR, CVIS, EFIN, SENV, ENRG,"
2010-02-25T10:00:00Z,Embassy Kuala Lumpur,"ECON, ETRD, KIPR, MY"
2010-02-24T13:47:00Z,Consulate Chiang Mai,"ECON, ETRD, EINV, EINT, KIPR, PREL, TH"
2010-02-22T20:23:00Z,Embassy Mexico,"ECON, KIPR, MX, ETRD, PREL, EINT, ENRG, BTIO"
2010-02-22T11:28:00Z,Embassy Tashkent,"ETRD, ECON, KIPR, UZ"
2010-02-22T10:00:00Z,"American Institute Taiwan, Taipei","ECON, ETRD, KIPR, TW"
2010-02-20T15:10:00Z,Embassy Riyadh,"KIPR, ETRD, ECON, PREL, SA"
2010-02-19T08:24:00Z,Consulate Shanghai,"KIPR, ECON, ETRD, PGOV, CH"
2010-02-18T17:01:00Z,Mission Geneva,"ECON, KIPR, WIPO"
2010-02-18T12:45:00Z,Embassy Oslo,"PTER, AF, CU, NO, KCRM, KIPR, KJUS, PREL, PREF, KTIP"
2010-02-17T05:59:00Z,Embassy Jakarta,"ECON, APECO, BEXP, EINV, ETRD, KIPR, ID"
2010-02-16T19:24:00Z,Embassy Moscow,"PGOV, TBIO, PREL, SOCI, ETRD, KIPR, RS"
2010-02-16T07:09:00Z,Embassy Madrid,"KIPR, ETRD, EUN, SP"
2010-02-16T05:23:00Z,Embassy Kuwait,"EINT, PGOV, ECPS, KIPR, EIND, ETRD, KU"
2010-02-12T15:25:00Z,Embassy Madrid,"ETRD, KIPR, PGOV, PREL, PHUM, SCUL, SP"
2010-02-12T12:23:00Z,Embassy Ashgabat,"PGOV, ECON, ETRD, KIPR, TX"
2010-02-12T10:24:00Z,Embassy Ashgabat,"PGOV, ECON, ETRD, KIPR, TX"
2010-02-12T07:29:00Z,Consulate Guangzhou,"ETRD, KIPR, ECON, PGOV, CH, HK"
2010-02-11T18:30:00Z,Embassy Caracas,"ECON, ECIN, EIND, EINT, EINV, ETRD, KIPR, VE"
2010-02-11T16:49:00Z,Embassy Athens,"ECON, KIPR, GR"
2010-02-11T15:46:00Z,Embassy Oslo,"SENV, KIPR, ETRD, AF, PREL, NO"
2010-02-10T21:50:00Z,Embassy Quito,"ETRD, KIPR, EINV, EC"
2010-02-10T10:41:00Z,Consulate Ho Chi Minh City,"ECON, KIPR, EAID, ETRD, VM"
2010-02-10T08:10:00Z,Consulate Guangzhou,"ETRD, ECON, KIPR, EFIN, EINV, PGOV, CH"
2010-02-10T07:38:00Z,Embassy Seoul,"CMGT, ECON, KIPR, KTIA, PHUM, PREL, KS"
2010-02-08T11:27:00Z,Embassy Madrid,"ECON, EFIN, EINV, ELAB, KIPR, SP"
2010-02-08T07:42:00Z,Embassy Madrid,"ECON, EFIN, ELAB, KIPR, SP"
2010-02-07T10:44:00Z,Consulate Dubai,"ETRD, KIPR, EFIN, ECON, PREL, AE"
2010-02-05T21:42:00Z,Embassy Mexico,"ECON, KIPR, MX, ETRD, PREL, EINT, ENRG, BTIO"
2010-02-05T16:16:00Z,Embassy Beirut,"ETRD, ECON, PREL, PGOV, EAID, MEPI, KIPR, LE"
2010-02-05T13:34:00Z,Embassy Kingston,"ECON, ETRD, EFIN, EINV, PREL, TRSY, USTR, KIPR, XL, JM"
2010-02-04T13:24:00Z,Consulate Dubai,"ETRD, KIPR, EFIN, ECON, PREL, AE, PK"
2010-02-04T02:54:00Z,Consulate Chengdu,"ECON, EIND, EINV, ETRD, PGOV, KIPR, CH"
2010-02-03T16:28:00Z,Embassy Rome,"ECPS, ETTC, KIPR, EINT, IT"
2010-02-02T09:45:00Z,Consulate Ho Chi Minh City,"ECON, KIPR, EAID, ETRD, VM"
2010-01-29T08:57:00Z,Embassy Ashgabat,"KIPR, ECON, PGOV, EINV, TX"
2010-01-29T08:26:00Z,Embassy Bandar Seri Begawan,"PREL, PGOV, USTR, KIPR, KINR, ECON, BX"
2010-01-29T04:56:00Z,Embassy Bangkok,"ECON, ETRD, EINV, KIPR, PREL, TH"
2010-01-28T12:56:00Z,Consulate Chengdu,"ECON, EIND, ETRD, EINV, PGOV, KIPR, KJUS, CH"
2010-01-28T11:55:00Z,Embassy Colombo,"KIPR, ECON, PGOV, CE"
2010-01-28T11:42:00Z,Embassy Ankara,"ECON, EINV, EIND, ETRD, KIPR, USTR, TU"
2010-01-27T14:32:00Z,Embassy Beirut,"ETRD, PGOV, KIPR, KDEM, PINR, KPAL, LE"
2010-01-27T12:32:00Z,Embassy Moscow,"TBIO, PREL, EAID, SOCI, KHIV, TSPL, ETRD, ELAB, EAGR, KIPR,"
2010-01-27T08:13:00Z,Embassy Bandar Seri Begawan,"ETRD, KIPR, ECON, EINV, USTR, BX"
2010-01-26T18:10:00Z,Embassy Madrid,"BEXP, ECON, EINV, ENRG, KIPR, SP"
2010-01-26T01:52:00Z,Embassy Bangkok,"ECON, EFIN, EINV, ELAB, ETRD, KIPR, OPIC, KTDB, USTR, TH"
2010-01-24T11:56:00Z,Embassy Riyadh,"ECON, PREL, KIPR, EINV, TSPL, SENV, SOCI, SA"
2010-01-22T17:00:00Z,Embassy Madrid,"ECON, EFIN, KIPR, SP"
2010-01-22T15:43:00Z,Embassy Madrid,"PREL, KIPR, AF, IR, XM, SP"
2010-01-22T03:46:00Z,Consulate Shanghai,"PREL, SENV, ECON, EINV, PGOV, KIPR, OVIP, (MURRAY, PATTY),"
2010-01-21T10:52:00Z,Mission Geneva,"ECON, KIPR, WIPO"
2010-01-21T09:51:00Z,Mission Geneva,"ECON, KIPR, WIPO"
2010-01-20T12:50:00Z,Embassy Kuwait,"EINT, PGOV, ECPS, KIPR, EIND, ETRD, KU"
2010-01-19T23:24:00Z,Embassy San Jose,"ETRD, KTDB, KIPR, OPIC, KIDE, USTR, ECON, CS, PGOV"
2010-01-19T12:30:00Z,Embassy Madrid,"EAIR, ECON, ECPS, EFIN, ELAB, KIPR, SP"
2010-01-19T10:11:00Z,Embassy Beijing,"PREL, PGOV, ECON, EFIN, KIPR, SENV, EINV, ETRD, PHUM,"
2010-01-19T00:41:00Z,Embassy Phnom Penh,"ECON, EFIN, EINV, ELAB, ETRD, KIPR, OPIC, KTDB, USTR, CB"
2010-01-14T13:50:00Z,Embassy Tallinn,"ETRD, KIPR, ECON, EN"
2010-01-14T11:04:00Z,Embassy Moscow,"TSPL, TNGD, TBIO, TINT, KIPR, KPAO, OEXC, SCUL, SOCI, PGOV,"
2010-01-13T13:50:00Z,Embassy Riyadh,"ETRD, KIPR, ECON, EINV, PREL, SA"
2010-01-13T06:42:00Z,Embassy Tashkent,"ECON, EINT, KIPR, UZ"
2010-01-11T14:36:00Z,Embassy Paris,"ECPS, EFIN, ETRD, EIND, KIPR, SCUL, FR"
2010-01-11T11:28:00Z,Embassy Kuwait,"EINT, PGOV, ECPS, KIPR, EIND, ETRD, KU"
2010-01-08T13:49:00Z,Embassy New Delhi,"ECON, EFIN, EINV, ECIN, KIPR, EIND, ELTN, ETRD, TSPA, IN, JA"
2010-01-08T12:06:00Z,Mission Geneva,"ECON, KIPR, WIPO"
2010-01-08T11:54:00Z,Mission Geneva,"ECON, KIPR, WIPO"
2010-01-08T08:20:00Z,Embassy Baku,"EINV, ETRD, BTIO, EFIN, KCOR, KIPR, AJ, TU, GG"
2010-01-07T10:11:00Z,Embassy Abu Dhabi,"PGOV, SOCI, KIPR, ECON, ENRG, AE"
2010-01-07T09:11:00Z,Consulate Guangzhou,"ENRG, SENV, PREL, ETRD, KIPR, PGOV, CH, HK"
2010-01-06T09:06:00Z,"American Institute Taiwan, Taipei","ECON, KIPR, ETRD, PGOV, TW"
2010-01-06T05:35:00Z,Embassy Seoul,"ETRD, KIPR, KS"
2010-01-04T10:03:00Z,Embassy Manila,"KIPR, ETRD, EAGR, RP"
2009-12-31T08:00:00Z,Embassy Beirut,"ECON, ESTH, EINT, PGOV, KGHG, KIPR, TSPL, LE"
2009-12-31T04:48:00Z,Embassy Bangkok,"ECON, ETRD, EINV, KIPR, PREL, TH"
2009-12-30T21:05:00Z,Embassy San Jose,"ECON, ETRD, KIPR, CS, PREL, PGOV"
2009-12-30T10:22:00Z,Embassy Bangkok,"ECON, ETRD, KIPR, PREL, TH"
2009-12-29T22:50:00Z,Embassy Caracas,"ECON, KIPR, EINV, ETRD, EIND, EINT, ECIN, CH, VE"
2009-12-29T08:21:00Z,Embassy Ankara,"EINV, ETRD, KTDB, KIPR, USTR, TU"
2009-12-28T06:03:00Z,Embassy Singapore,"ETRD, ECON, EFIN, EINV, ECPS, SENV, EAGR, KTEX, KIPR, SN"
2009-12-23T10:46:00Z,Embassy Paris,"ECON, ETRD, KIPR, FR"
2009-12-23T09:27:00Z,Embassy Paris,"ECON, ETRD, KIPR, PREL, FR"
2009-12-23T09:11:00Z,Embassy Beijing,"PREL, PGOV, ECON, EFIN, KIPR, SENV, EINV, ETRD, PHUM,"
2009-12-23T08:15:00Z,Embassy Beijing,"KIPR, ECON, ETRD, CH"
2009-12-22T20:07:00Z,Embassy San Jose,"ETRD, KIPR, ECON, CS, PREL, PGOV"
2009-12-22T12:49:00Z,Embassy Madrid,"KIPR, SP"
2009-12-22T03:58:00Z,Embassy Beijing,"ECON, EIND, EINV, ETRD, KIPR, CH"
2009-12-21T18:52:00Z,Embassy Brasilia,"ETRD, KIPR, ECON, EFIN, EINV, EAGR, BR"
2009-12-21T15:30:00Z,Embassy Rome,"IT, KIPR, ETRD, ECON, EINT"
2009-12-21T15:29:00Z,Embassy Rome,"IT, KIPR, ETRD, ECON, EINT"
2009-12-18T16:47:00Z,Embassy Paris,"ECPS, ETRD, EIND, KIPR, SCUL, FR"
2009-12-17T11:39:00Z,Consulate Jeddah,"KPAO, SA, SCUL, KIPR, SOCI"
2009-12-16T14:44:00Z,Embassy Riyadh,"ETRD, KIPR, ECON, EINV, PREL, SA"
2009-12-15T14:05:00Z,Embassy Riyadh,"ETRD, KIPR, ECON, EINV, PREL, SA"
2009-12-14T15:22:00Z,USEU Brussels,"KIPR, EIND, ETRD, SENV, ECON, TPHY, TSPL, EUR, EUN"
2009-12-14T14:14:00Z,USEU Brussels,"KIPR, EIND, ETRD, SENV, ECON, TPHY, TSPL, EUR, EUN"
2009-12-14T13:49:00Z,Embassy Stockholm,"KIPR, EINT, ETRD, ECON, PGOV, SW"
2009-12-14T11:02:00Z,Consulate Dubai,"ETRD, KIPR, EFIN, ECON, PREL, AE"
2009-12-12T22:55:00Z,Consulate Chengdu,"ECON, EINV, EIND, ETRD, PGOV, KIPR, CH"
2009-12-11T22:33:00Z,Embassy San Jose,"ECON, ETRD, KIPR, PREL, PGOV, CS"
2009-12-11T06:16:00Z,Consulate Shanghai,"ECON, EIND, EINV, PREL, KIPR, CH, ETRD, SCUL"
2009-12-10T18:01:00Z,Embassy Warsaw,"ECON, ETRD, KIPR, PL"
2009-12-10T14:05:00Z,Consulate Dubai,"ETRD, KIPR, EFIN, ECON, PREL, AE"
2009-12-10T13:21:00Z,Embassy Kuwait,"KBCT, ECON, KIPR, EIND, EINT, ETRD, XF, KU"
2009-12-10T13:15:00Z,Embassy Ashgabat,"KIPR, TBIO, TNGD, TPHY, TRGY, TSPA, PGOV, TX"
2009-12-09T11:36:00Z,Embassy Tashkent,"PREL, ETRD, ELAB, PHUM, ECON, SOCI, KIPR, UZ"
2009-12-09T08:12:00Z,Embassy Tokyo,"ECON, ETRD, EFIN, EINV, KIPR, ECPS, SN"
2009-12-09T00:02:00Z,Consulate Chengdu,"EFIN, EINV, ETRD, PGOV, KIPR, CH"
2009-12-08T20:46:00Z,Embassy Tegucigalpa,"BBSR, ECON, EIND, ETRD, KIPR, HO"
2009-12-08T12:17:00Z,Mission Geneva,"ECON, KIPR, WIPO"
2009-12-08T09:08:00Z,Embassy Astana,"PGOV, PREL, ECON, ETRD, EFIN, EINV, KIPR, KZ"
2009-12-07T06:27:00Z,Embassy Colombo,"KIPR, ECON, PGOV, CE"
2009-12-04T16:44:00Z,Embassy Madrid,"KIPR, PGOV, SP"
2009-12-03T17:37:00Z,Embassy San Jose,"CJAN, SNAR, KIPR, PGOV, PREL, CS"
2009-12-02T12:00:00Z,Embassy Madrid,"KIPR, ETRD, ECPS, SP"
2009-12-01T15:24:00Z,Embassy Santiago,"ECON, KIPR, TRGY, DEA, CI, BL"
2009-12-01T13:15:00Z,Consulate Dubai,"ETRD, KIPR, EFIN, ECON, PREL, AE"
2009-11-27T12:19:00Z,Embassy Madrid,"ECPS, KIPR, SP"
2009-11-27T08:16:00Z,Embassy Colombo,"KIPR, ECON, PGOV, CE"
2009-11-24T16:18:00Z,Embassy San Jose,"ETRD, ECON, KIPR, PREL, PGOV, CS"
2009-11-24T14:10:00Z,Embassy Riyadh,"ETRD, KIPR, SA"
2009-11-24T14:08:00Z,Embassy Paris,"ECON, ETTC, ETRD, BEXP, KIPR, PREL, FR"
2009-11-24T12:31:00Z,Embassy Stockholm,"KIPR, EINT, ETRD, ECON, PGOV, SW"
2009-11-24T12:24:00Z,Embassy New Delhi,"ETRD, EAGR, EINV, KIPR, IN"
2009-11-24T09:25:00Z,Embassy Bangkok,"ECON, ETRD, KIPR, PREL, TH"
2009-11-24T06:43:00Z,Embassy Stockholm,"KIPR, EINT, ECPS, ETRD, PGOV, SW"
2009-11-23T23:41:00Z,Embassy Mexico,"KIPR, ECON, SNAR, MX"
2009-11-23T21:11:00Z,Embassy Santiago,"ECON, OECD, EFIN, ECIN, KIPR, PREL, PGOV, AORC, CI"
2009-11-23T12:30:00Z,Embassy Sofia,"PGOV, EFIN, ECON, KIPR, KJUS, BU"
2009-11-23T12:25:00Z,Consulate Dubai,"ETRD, KIPR, EFIN, ECON, PREL, AE"
2009-11-23T10:31:00Z,Embassy Bangkok,"ECON, ETRD, KIPR, PREL, TH"
2009-11-23T06:36:00Z,Embassy Riyadh,"ETRD, KIPR, ECON, EINV, PREL, SA"
2009-11-23T05:34:00Z,Embassy Riyadh,"ETRD, KIPR, ECON, EINV, PREL, SA"
2009-11-22T06:47:00Z,Embassy Riyadh,"ETRD, KIPR, ECON, EINV, PREL, SA"
2009-11-22T06:46:00Z,Embassy Riyadh,"ETRD, KIPR, ECON, EINV, PREL, SA"
2009-11-20T16:22:00Z,Embassy Madrid,"ECON, ECPS, EFIN, EIND, EINV, ENRG, KIPR, PGOV, SP"
2009-11-20T16:00:00Z,Embassy Lisbon,"ECON, KIPR, PGOV, PO, SZ, EU, UK, FR, GM"
2009-11-20T13:51:00Z,Embassy Brasilia,"KIPR, ETRD, ECON, BR"
2009-11-20T06:58:00Z,Embassy Ankara,"ECON, KCRM, KIPR, ETRD, TU"
2009-11-20T02:28:00Z,Embassy Islamabad,"ECON, KIPR, PGOV, PK"
2009-11-20T00:16:00Z,Consulate Guangzhou,"KPAO, KMDR, PREL, KIPR, ETRD, OVIP, CH"
2009-11-19T17:49:00Z,Embassy Paris,"ETRD, SENV, EAGR, KIPR, KGHG, ISO, FR"
2009-11-19T11:35:00Z,Consulate Jeddah,"KIPR, KPAO, SA, SCUL, SOCI"
2009-11-18T07:48:00Z,Consulate Chengdu,"ETRD, EINV, PGOV, KIPR, KNNP, CH"
2009-11-16T13:00:00Z,Embassy Stockholm,"ECPS, ETTC, KIPR, SENV, EINT, ETRD, OVIP, PGOV, SW"
2009-11-16T04:08:00Z,Consulate Dubai,"ETRD, KIPR, EFIN, ECON, PREL, AE"
2009-11-15T14:14:00Z,Consulate Dubai,"ETRD, KIPR, EFIN, ECON, PREL, AE"
2009-11-13T16:09:00Z,Embassy Madrid,"KIPR, ETRD, ECPS, SP"
2009-11-13T15:05:00Z,Embassy Kyiv,"KIPR, CDC, SOCI, PREL, AMED, CASC, XH, UP"
2009-11-13T14:46:00Z,Embassy Moscow,"ECON, ETRD, KIPR, RS, WTO"
2009-11-13T14:22:00Z,Embassy Ankara,"ECON, EINV, KCRM, KIPR, TU"
2009-11-13T14:14:00Z,Embassy Kyiv,"KIPR, UP"
2009-11-13T12:45:00Z,Embassy Stockholm,"ECPS, KIPR, ETRD, EINT, OVIP, PGOV, SW"
2009-11-13T09:58:00Z,Embassy Beijing,"ECON, EIND, EINV, ETRD, KIPR, CH"
2009-11-12T16:09:00Z,Embassy Athens,"ECON, ETRD, EUN, KIPR, GR"
2009-11-10T16:10:00Z,Mission Geneva,"ECON, KIPR, WIPO"
2009-11-10T05:19:00Z,Embassy Astana,"PGOV, PREL, ECON, ETRD, KIPR, RS, BO, KZ"
2009-11-10T02:08:00Z,Consulate Chengdu,"ECON, KIPR, CH"
2009-11-09T14:06:00Z,Embassy Paris,"ETRD, ECON, KIPR, FR"
2009-11-09T12:28:00Z,Embassy Kuwait,"KIPR, EIND, EINT, ETRD, KU"
2009-11-09T06:04:00Z,Embassy Riyadh,"ETRD, KIPR, ECON, EINV, PREL, SA"
2009-11-07T15:22:00Z,Consulate Jeddah,"KIPR, KPAO, SA, SCUL, SOCI"
2009-11-06T13:14:00Z,Embassy Madrid,"ECON, EFIN, ELAB, KIPR, SP"
2009-11-06T09:26:00Z,Consulate Guangzhou,"ETRD, ECON, KIPR, PREL, EINV, CH"
2009-11-06T06:53:00Z,Embassy Manila,"ETRD, KIPR, ECON, RP"
2009-11-04T19:57:00Z,Embassy Ottawa,"ECON, ETRD, KIPR, CA"
2009-11-04T10:48:00Z,Embassy Madrid,"KIPR, WIPO, SP"
2009-11-04T10:48:00Z,Embassy Madrid,"KIPR, ETRD, ECPS, SP"
2009-11-04T09:16:00Z,Consulate Guangzhou,"KIPR, ETRD, EINV, PREL, PGOV, CH, TW, HK"
2009-11-03T12:44:00Z,Consulate Dubai,"ETRD, KIPR, EFIN, ECON, PREL, AE"
2009-11-03T10:35:00Z,Embassy Riyadh,"ETRD, KIPR, ECON, EINV, PREL, SA"
2009-11-03T08:10:00Z,Consulate Guangzhou,"ETRD, KIPR, PREL, KPAO, KIND, ECON, PGOV, CH"
2009-11-02T11:47:00Z,Embassy Baku,"ECON, EINV, EIND, EAIR, KCOR, TINT, KIPR, AJ, TU, AE,"
2009-11-02T09:55:00Z,Consulate Guangzhou,"ETRD, KIPR, PREL, ECON, EINV, PGOV, CH"
2009-10-30T16:25:00Z,Embassy Rome,"ECON, ETRD, EUN, KIPR, IT"
2009-10-30T15:49:00Z,Embassy Budapest,"ECON, ETRD, KIPR, HU"
2009-10-30T09:46:00Z,Consulate Hong Kong,"ECON, EFIN, EINV, ETRDGK, KIPR, HK, CH"
2009-10-30T03:21:00Z,Consulate Guangzhou,"ETRD, KIPR, ECON, PGOV, CH"
2009-10-30T00:50:00Z,Consulate Guangzhou,"ETRD, KIPR, PREL, ECON, EINV, PGOV, CH"
2009-10-29T15:23:00Z,Embassy Paris,"ETRD, ECON, EAGR, KIPR, FR"
2009-10-29T14:56:00Z,Embassy Paris,"ETRD, ECON, EAGR, KIPR, FR"
2009-10-28T15:29:00Z,Embassy Madrid,"ETRD, KIPR, EINV, ECPS, KCRM, SP"
2009-10-28T14:06:00Z,Embassy Stockholm,"KIPR, ETRD, ECON, PREL, SW"
2009-10-28T07:17:00Z,Embassy Helsinki,"ECON, ETRD, EUN, KIPR, FI"
2009-10-28T02:10:00Z,Embassy Hanoi,"ECON, ETRD, KIPR, SOCI, PGOV, VM"
2009-10-27T20:48:00Z,Embassy San Jose,"ECON, ETRD, KIPR, EINV, PREL, PGOV, CS"
2009-10-27T11:01:00Z,Embassy Riyadh,"ETRD, KIPR, ECON, EINV, PREL, SA"
2009-10-27T10:56:00Z,Embassy London,"ECON, ETRD, EUN, KIPR"
2009-10-27T10:26:00Z,Embassy Riyadh,"ETRD, KIPR, ECON, EINV, PREL, SA"
2009-10-27T09:37:00Z,Embassy Riyadh,"ETRD, KIPR, ECON, EINV, PREL, SA"
2009-10-27T09:34:00Z,Embassy Vienna,"ECON, ETRD, EUN, KIPR, AU"
2009-10-27T09:28:00Z,Embassy Riyadh,"ETRD, KIPR, ECON, EINV, PREL, SA"
2009-10-26T13:20:00Z,Embassy Sofia,"KIPR, ECON, PGOV, BU"
2009-10-26T06:36:00Z,Embassy Berlin,"ECON, ETRD, EUN, KIPR"
2009-10-23T12:30:00Z,Embassy Athens,"ECON, ETRD, EUN, KIPR, GR"
2009-10-23T08:25:00Z,Embassy Madrid,"ECON, ETRD, KIPR, EUN, SP"
2009-10-23T04:42:00Z,Embassy Colombo,"ECON, ETRD, EAGR, EINV, ELAB, KIPR, KTEX, CE"
2009-10-22T14:29:00Z,Embassy Budapest,"ECON, ETRD, EUN, KIPR, HU"
2009-10-22T13:33:00Z,Consulate Dubai,"ETRD, KIPR, EFIN, ECON, PREL, AE"
2009-10-22T10:14:00Z,Embassy Lisbon,"ECON, KIPR, PGOV, PO, SZ, EU, UK, FR, GM"
2009-10-21T21:19:00Z,Embassy Quito,"ETRD, KIPR, EIND, EC"
2009-10-21T13:01:00Z,Embassy Tallinn,"ECON, ETRD, EUN, EN, KIPR"
2009-10-21T12:45:00Z,Embassy Lisbon,"ECON, EAGR, ETRD, PGOV, PREL, EUN, KIPR, PO"
2009-10-20T16:05:00Z,Embassy Madrid,"PREL, MOPS, KIPR, SP, AF, KV, BK, LE, IR, CU, HO"
2009-10-19T09:51:00Z,Embassy Bucharest,"ECON, ETRD, EUN, KIPR, RO"
2009-10-16T13:29:00Z,Embassy Prague,"KIPR, ECON, ETRD"
2009-10-16T04:44:00Z,Embassy Tashkent,"ECON, ETRD, KIPR, UZ"
2009-10-15T09:55:00Z,Embassy Riyadh,"ETRD, KIPR, ECON, EINV, PREL, SA"
2009-10-15T07:21:00Z,Embassy Seoul,"ETRD, KIPR, KS"
2009-10-13T19:16:00Z,Embassy Quito,"ETRD, KIPR, EIND, EC"
2009-10-13T17:25:00Z,Embassy Riyadh,"ECON, EINV, ETRD, KIPR, PREL, SA"
2009-10-06T15:04:00Z,Embassy Madrid,"KIPR, ETRD, ECPS, KCRM, SP"
2009-10-05T06:42:00Z,Embassy The Hague,"EINT, ECON, KIPR, NL"
2009-10-01T16:06:00Z,Embassy Mexico,"KIPR, ECON, SNAR, MX"
2009-10-01T13:19:00Z,Embassy Mexico,"KIPR, ECON, SNAR, MX"
2009-10-01T04:17:00Z,Embassy Stockholm,"KIPR, EINV, ETRD, PREL, SW, CM"
2009-09-30T07:40:00Z,Consulate Guangzhou,"ETRD, PREL, EINV, KIPR, ECON, PGOV, TW, CH"
2009-09-28T19:18:00Z,Embassy Managua,"ECON, ETRD, KIPR, USTR, NU"
2009-09-28T08:29:00Z,Consulate Dubai,"ETRD, KIPR, EFIN, ECON, PREL, AE"
2009-09-24T15:23:00Z,Embassy Tripoli,"ECON, ECIN, ELAB, EPET, EMIN, KIPR, PGOV, BBSR, LY"
2009-09-21T09:32:00Z,Embassy Brasilia,"ECON, TSPL, TPHY, TNGD, TINT, KIPR, KSCA, NSF, BR"
2009-09-18T15:44:00Z,Embassy Madrid,"ECON, EIND, EINV, ELAB, ENRG, EPET, KIPR, SP"
2009-09-18T11:39:00Z,Embassy Oslo,"BEXP, KIPR, ETRD, EINV, EPET, ENRG, NO"
2009-09-18T08:52:00Z,Embassy Beijing,"ECON, ETRD, KIPR, PGOV, CH"
2009-09-16T14:45:00Z,Embassy Paris,"ECON, EIND,ETRD, KIPR, PREL, FR"
2009-09-15T04:20:00Z,Embassy Abuja,"ECON: ETRD, KIPR, WIPO, NI"
2009-09-15T02:08:00Z,Consulate Hong Kong,"ECON, EFIN, EINV, ETRD, KIPR, HK, CH"
2009-09-14T18:26:00Z,Embassy Buenos Aires,"TBIO, SOCI, PREL, AMED, ELAB, CASC, KIPR, AR"
2009-09-14T13:29:00Z,Embassy Riyadh,"ECON, ETRD, KIPR, SA"
2009-09-14T12:59:00Z,Consulate Dubai,"ETRD, KIPR, EFIN, ECON, PREL, AE"
2009-09-14T06:14:00Z,Embassy Kuala Lumpur,"ECON, ETRD, KIPR, MY"
2009-09-13T14:49:00Z,Embassy Algiers,"ECON, KIPR, ETRD, WIPO, AG"
2009-09-11T16:53:00Z,Embassy Brasilia,"PHUM, PREL, KIPR, ETRD, ECON, UN, BR"
2009-09-11T09:00:00Z,Embassy Manila,"ETRD, KIPR, EINV, ECON, RP"
2009-09-11T07:57:00Z,Embassy Rome,"IT, KIPR, ETRD, ECON, EINT"
2009-09-09T04:00:00Z,Embassy Bandar Seri Begawan,"KIPR, ETRD, ECON, EINV, USTR, BX"
2009-09-08T13:07:00Z,Embassy Brasilia,"EAGR, TBIO, ECON, KSCA, KIPR, EAID, ETRD, BR"
2009-09-08T10:29:00Z,Embassy Beijing,"ETRD, PREL, EINV, KIPR, CM, TW"
2009-09-04T14:27:00Z,Secretary of State,"ECON, ETRD, KIPR, WIPO"
2009-09-04T06:07:00Z,Embassy Bandar Seri Begawan,"KIPR, ETRD, ECON, EINV, USTR, BX"
2009-09-04T05:58:00Z,Embassy Bandar Seri Begawan,"KIPR, ETRD, ECON, EINV, USTR, BX"
2009-09-04T05:55:00Z,Consulate Hong Kong,"ECON, EFIN, EINV, ETRD, KIPR, HK, CH"
2009-09-03T18:27:00Z,Secretary of State,"ECON, ETRD, KIPR, CA"
2009-09-03T14:58:00Z,Mission Geneva,"ECON, KIPR, SENV, WIPO"
2009-09-03T13:26:00Z,Mission Geneva,"ECON, KIPR, WIPO"
2009-08-30T06:31:00Z,Consulate Dubai,"ETRD, KIPR, EFIN, ECON, PREL, AE"
2009-08-28T11:19:00Z,Embassy Tashkent,"ECON, PREL, TSPL, ETTC, KTIA, KIPR, KSTC, UZ"
2009-08-28T01:06:00Z,Embassy Bandar Seri Begawan,"KIPR, ETRD, ECON, EINV, USTR, BX"
2009-08-25T10:10:00Z,Embassy Stockholm,"KIPR, ECON, ETRD, PGOV, SW"
2009-08-25T06:43:00Z,Consulate Guangzhou,"ETRD, KIPR, KIND, ECON, EINV, PGOV, CH"
2009-08-21T15:32:00Z,Embassy Buenos Aires,"TBIO, SOCI, PREL, AMED, ELAB, CASC, KIPR, AR"
2009-08-21T15:23:00Z,Embassy Brasilia,"KIPR, ETRD, ECON, BR"
2009-08-21T14:10:00Z,Embassy Ottawa,"ECON, ETRD, KIPR, CA"
2009-08-21T02:10:00Z,Consulate Ho Chi Minh City,"ECON, KIPR, EAID, ETRD, VM"
2009-08-20T08:14:00Z,Consulate Guangzhou,"ETRD, KIPR, ECON, PGOV, CH"
2009-08-18T06:23:00Z,Consulate Dubai,"ETRD, KIPR, EFIN, ECON, PREL, AF, TC"
2009-08-17T17:15:00Z,Embassy Brasilia,"KIPR, ETRD, ECON, BR"
2009-08-17T11:02:00Z,Embassy Beirut,"BEXP, ECON, EFIN, EINV, ETRD, KIPR, PGOV, LE, SOCI"
2009-08-14T10:24:00Z,Embassy Madrid,"ECON, ELAB, EFIN, ECPS, KIPR"
2009-08-13T06:51:00Z,Embassy Beirut,"ECON, EFIN, ELTN, EINV, ENRG, ETRD, KIPR, KFLU, PGOV, LE"
2009-08-13T06:51:00Z,Embassy Beirut,"ECON, EFIN, ELTN, EINV, ENRG, ETRD, KIPR, KFLU, PGOV, LE"
2009-08-13T02:52:00Z,Embassy Singapore,"KIPR, ETRD, EINV, ECON, SN"
2009-08-12T07:25:00Z,Embassy Moscow,"ECON, ETRD, KIPR, KCRM, RS, WTO"
2009-08-10T12:58:00Z,Embassy Vienna,"ECON, EINT, ETRD, KIPR, AU"
2009-08-10T01:45:00Z,Embassy New Delhi,"ECON, EAGR, EFIN, EPET, ETRD, BEXP, KIPR, IN, XB, XA"
2009-08-07T05:45:00Z,Embassy Moscow,"ECON, ETRD, KIPR, RS, WTO"
2009-08-06T15:32:00Z,Embassy Buenos Aires,"TBIO, SOCI, PREL, AMED, ELAB, CASC, KIPR, AR"
2009-08-06T11:29:00Z,Embassy Amman,"ECON, ETRD, KIPR, SNAR, JO"
2009-08-06T08:18:00Z,Embassy Beijing,"ECON, ETRD, EINV, KIPR, CH"
2009-08-06T03:36:00Z,Embassy Beirut,"BEXP, ECON, EFIN, EIND, ETRD, KIPR, KFLU, PGOV, SENV, LE"
2009-08-03T12:16:00Z,Embassy Tashkent,"ECON, PREL, TSPL, ETTC, KTIA, KIPR, KSTC, UZ"
2009-08-03T12:15:00Z,Embassy Tashkent,"ECON, PREL, TSPL, ETTC, KTIA, KIPR, KSTC, UZ"
2009-07-31T11:11:00Z,Embassy New Delhi,"ECON, EAGR, EFIN, EINV, ENRG, EPET, ETRD, BEXP, KIPR, IN, CN"
2009-07-29T16:18:00Z,Embassy Bridgetown,"KIPR, ETRD, XL"
2009-07-29T12:50:00Z,Embassy Riyadh,"ECON, ETRD, EINV, KIPR, SA"
2009-07-29T09:57:00Z,Embassy Amman,"ECON, ETRD, KIPR, SNAR, JO"
2009-07-28T11:56:00Z,Embassy Tashkent,"ECON, PREL, TSPL, ETTC, KTIA, KIPR, KSTC, UZ"
2009-07-27T18:53:00Z,Embassy Ottawa,"ECON, ETRD, KIPR, CA"
2009-07-27T11:53:00Z,Embassy Beirut,"ECON, EFIN, EIND, ETRD, EWWT, KIPR, KFLU, PGOV, LE"
2009-07-23T12:25:00Z,Embassy Santiago,"ECON, ETRD, KIPR, PGOV, PREL, CI"
2009-07-22T06:37:00Z,"American Institute Taiwan, Taipei","ECON, ETRD, KIPR, TW"
2009-07-22T06:05:00Z,Embassy Abu Dhabi,"ECON, ETRD, KIPR, PGOV, PTER, AE"
2009-07-22T02:36:00Z,Embassy Moscow,"PGOV, ETRD, KIPR, ECON, RS"
2009-07-21T13:53:00Z,Embassy San Jose,"ETRD, ECON, KIPR, PGOV, PREL, CS"
2009-07-20T08:33:00Z,Mission Geneva,"ECON, KIPR, WIPO"
2009-07-16T08:59:00Z,Consulate Shanghai,"KIPR, ECON, ETRD, PGOV, PREL, ECIN, CH"
2009-07-16T06:00:00Z,Embassy Beijing,"ETRD, KIPR, ECON, PGOV, CH"
2009-07-16T05:22:00Z,Embassy Beijing,"ETRD, KIPR, ECON, PGOV, CH"
2009-07-16T01:05:00Z,Consulate Shanghai,"CH, ECON, KIPR, PGOV, PINR"
2009-07-15T10:15:00Z,Consulate Ho Chi Minh City,"ECON, ETRD, KIPR, SOCI, PGOV, VM"
2009-07-08T13:28:00Z,Consulate Casablanca,"ECON, ETRD, KIPR, PGOV, MO"
2009-07-07T10:01:00Z,Embassy Hanoi,"ECON, KIPR, PGOV, PHUM, VM"
2009-07-07T07:20:00Z,Embassy Bandar Seri Begawan,"KIPR, ETRD, ECON, EINV, USTR, BX"
2009-07-06T14:17:00Z,Mission Geneva,"ECON, KIPR, WIPO"
2009-07-06T09:31:00Z,Embassy Tashkent,"ECON, PREL, TSPL, ETTC, KTIA, KIPR, KSTC, UZ"
2009-06-26T09:11:00Z,Embassy Ankara,"KIPR, ECON, ETRD, TU"
2009-06-25T20:55:00Z,Consulate Monterrey,"ASEC, SNAR, CASC, KCRM, PHUM, KIPR, PGOV, MX"
2009-06-24T11:47:00Z,Mission Geneva,"ECON, KIPR, WIPO"
2009-06-24T08:42:00Z,"American Institute Taiwan, Taipei","ECON, ETRD, KIPR, TW"
2009-06-24T08:17:00Z,"American Institute Taiwan, Taipei","ECON, ETRD, KIPR, TW"
2009-06-24T07:20:00Z,Embassy Sofia,"PREL, PGOV, KIPR, BU"
2009-06-23T07:40:00Z,Embassy Beijing,"BEXP, ECON, EINV, ETRD, KIPR, CH"
2009-06-22T13:59:00Z,Embassy Madrid,"KIPR, SP"
2009-06-22T12:35:00Z,Embassy Beirut,"ECON, EFIN, EIND, PGOV, KIPR, KFLU, LE"
2009-06-22T01:44:00Z,Consulate Shanghai,"KIPR, ETRD, KPAO, SCUL, CH"
2009-06-19T07:31:00Z,Embassy Tokyo,"KIPR, ECON, ETRD, PGOV, JA"
2009-06-17T06:39:00Z,Consulate Hong Kong,"KIPR, PGOV, ETRD, ECON, HK"
2009-06-16T12:13:00Z,Embassy Abu Dhabi,"ETRD, PTER, KIPR, ECON, PREL, PGOV, SA, AE"
2009-06-15T12:39:00Z,Embassy Riyadh,"ECON, EINV, ETRD, PREL, KIPR, SA"
2009-06-15T05:07:00Z,Embassy Riyadh,"ECON, EINV, ETRD, PREL, KIPR, SA"
2009-06-11T19:07:00Z,Embassy Santiago,"ECON, PGOV, PREL, SOCI, KIPR, CI"
2009-06-10T19:58:00Z,Embassy Buenos Aires,"KIPR, ECON, PGOV, PREL, AR"
2009-06-10T12:42:00Z,Embassy Stockholm,"PGOV, PINR, PREL, ECON, KIPR, SW"
2009-06-09T09:59:00Z,Embassy Abu Dhabi,"ECON, KIPR, PREL, ETRD, AE"
2009-06-08T07:56:00Z,Consulate Shanghai,"KIPR, ETRD, EINV, EFIN, PGOV, CH"
2009-06-08T05:51:00Z,Consulate Shanghai,"PGOV, ECON, EFIN, ETRD, KIPR, CH"
2009-06-05T08:44:00Z,Embassy Beijing,"EINT, ECON, KIPR, CH"
2009-06-04T10:38:00Z,US Mission Geneva,"ECON, KIPR, WIPO"
2009-06-04T10:32:00Z,US Mission Geneva,"ECON, KIPR, WIPO"
2009-06-04T02:44:00Z,Consulate Shanghai,"CH, ECON, EFIN, KIPR, PGOV, PREL, SENV"
2009-06-03T08:41:00Z,Embassy Bangkok,"ECON, ETRD, KIPR, PINR, PREL, TH"
2009-06-02T11:18:00Z,Embassy Moscow,"PGOV, ETRD, KIPR, ECON, RS"
2009-06-02T08:22:00Z,Embassy Beijing,"ETRD, EIND, KIPR, ECON, CH"
2009-06-01T13:27:00Z,Embassy Abuja,"KIPR, ETRD, PGOV, NI"
2009-05-29T05:30:00Z,Consulate Shanghai,"ENRG, SENV, KIPR, KGHG, TRGY, OVIP, (PELOSI, NANCY), CH"
2009-05-26T06:48:00Z,Consulate Guangzhou,"ETRD, KIPR, KIND, ECON, PGOV, CH"
2009-05-25T23:39:00Z,Consulate Shanghai,"SENV, ENRG, PREL, PHUM, KIPR, OVIP, (PELOSI, NANCY), CH"
2009-05-22T06:51:00Z,Embassy Nairobi,"ECON, ELAB, ECPS, EINV, EFIN, ETRD, KIPR, PINR, KE"
2009-05-21T16:00:00Z,Embassy Quito,"ECON, KIPR, ETRD, EC"
2009-05-18T03:36:00Z,Embassy Beirut,"ECON, EFIN, ETRD, KIPR, PGOV, LE"
2009-05-18T01:54:00Z,Embassy Manila,"ETRD, KIPR, ECON, RP"
2009-05-17T22:43:00Z,Embassy Manila,"ETRD, KIPR, ECON, RP"
2009-05-15T09:52:00Z,Embassy Bangkok,"ECON, ETRD, KIPR, PINR, PREL, TH"
2009-05-14T22:40:00Z,Embassy Wellington,"ECON, ETRD, KIPR, NZ"
2009-05-14T13:04:00Z,Embassy Madrid,"ECON, EFIN, ELAB, ENRG, KIPR, SP"
2009-05-14T13:03:00Z,Embassy Ankara,"KIPR, USTR, ECON, TU"
2009-05-12T21:29:00Z,Embassy San Jose,"CS, ECON, ETRD, KIPR, PGOV, PREL"
2009-05-12T12:08:00Z,Embassy Rome,"IT, KIPR, ETRD, ECON, EINT"
2009-05-12T03:13:00Z,Consulate Hong Kong,"ECON, ETRD, KIPR, HK, CH"
2009-05-08T16:39:00Z,Embassy Santiago,"ECON, EINV, EFIN, ETRD, KIPR, EFTA, CI"
2009-05-08T14:43:00Z,Embassy Kyiv,"ETRD, KIPR, ECON, UP"
2009-05-08T13:21:00Z,Embassy Sofia,"ECON, ETRD, KIPR, BU"
2009-05-07T07:20:00Z,Consulate Shanghai,"PGOV, ECON, ELTN, CVIS, TPHY, SENV, SCUL, KIPR, CH"
2009-05-06T04:32:00Z,Embassy Abu Dhabi,"ECON, KIPR, PREL, ETRD, AE"
2009-05-05T16:09:00Z,Embassy Kingston,"ECON, ETRD, KIPR, TRSY, XL, JM"
2009-05-05T11:20:00Z,Embassy Stockholm,"KIPR, ECON, ETRD, PGOV, SW"
2009-05-04T12:50:00Z,Embassy Managua,"ECON, ETRD, KIPR, NU"
2009-05-04T10:18:00Z,Embassy Budapest,"ECON, ETRD,KIPR, EU, HU"
2009-05-04T09:59:00Z,Embassy Amman,"ECON, ETRD, KIPR, JO"
2009-05-04T08:48:00Z,Consulate Hong Kong,"ECON, ETRD, KIPR, HK, CH"
2009-05-01T13:08:00Z,Embassy Ashgabat,"ECON, ETRD, KIPR, TX"
2009-05-01T10:10:00Z,Embassy New Delhi,"ETRD, ECON, KIPR, IN"
2009-05-01T05:47:00Z,Embassy Tokyo,"EIND, EINT, ETRD, ETTC, JA, KIPR, TINT, CH"
2009-04-30T17:30:00Z,Embassy Ottawa,"ECON, ETRD, KIPR, CA"
2009-04-30T14:56:00Z,Embassy La Paz,"KIPR, ECON, ETRD, BL"
2009-04-30T12:44:00Z,Embassy Rome,"KIPR, ECON, ETRD, IT"
2009-04-30T12:33:00Z,Embassy Tashkent,"ECON, ETRD, KIPR, UZ"
2009-04-30T11:01:00Z,Embassy Nicosia,"KIPR, CY"
2009-04-30T09:53:00Z,Embassy Abuja,"KIPR, ETRD, ECON, EINV, EAID, PGOV, NI"
2009-04-30T09:40:00Z,Embassy Jakarta,"KIPR, EINV, ETRD, ECON, ID"
2009-04-30T09:01:00Z,Embassy Vilnius,"ETRD, ECON, KIPR, LH, HT25"
